{
  "id": "2319",
  "slug": "check-if-matrix-is-x-matrix",
  "title": "Check if Matrix Is X-Matrix",
  "category": "dsa",
  "subcategory": "arrays",
  "difficulty": "Easy",
  "tags": [
    "Array",
    "Matrix"
  ],
  "statement": "A square matrix is said to be an **X-Matrix** if **both** of the following conditions hold:\n\n1.  All the elements in the diagonals of the matrix are **non-zero**.\n2.  All other elements are 0.\n\nGiven a 2D integer array `grid` of size `n x n` representing a square matrix, return `true` _if_ `grid` _is an X-Matrix_. Otherwise, return `false`.\n\n**Example 1:**\n\n![](./assets/check-if-matrix-is-x-matrix-1.jpg)\n```\nInput: grid = [[2,0,0,1],[0,3,1,0],[0,5,2,0],[4,0,0,2]]\nOutput: true\nExplanation: Refer to the diagram above. \nAn X-Matrix should have the green elements (diagonals) be non-zero and the red elements be 0.\nThus, grid is an X-Matrix.\n```\n\n**Example 2:**\n\n![](./assets/check-if-matrix-is-x-matrix-2.jpg)\n```\nInput: grid = [[5,7,0],[0,3,1],[0,5,0]]\nOutput: false\nExplanation: Refer to the diagram above.\nAn X-Matrix should have the green elements (diagonals) be non-zero and the red elements be 0.\nThus, grid is not an X-Matrix.\n```\n\n**Constraints:**\n\n*   `n == grid.length == grid[i].length`\n*   `3 <= n <= 100`\n*   `0 <= grid[i][j] <= 10^(5)`",
  "constraints": [
    "n == grid.length == grid[i].length",
    "3 <= n <= 100",
    "0 <= grid[i][j] <= 105"
  ],
  "examples": [
    {
      "input": "grid = [[2,0,0,1],[0,3,1,0],[0,5,2,0],[4,0,0,2]]",
      "output": "true",
      "explanation": "Refer to the diagram above. \nAn X-Matrix should have the green elements (diagonals) be non-zero and the red elements be 0.\nThus, grid is an X-Matrix."
    },
    {
      "input": "grid = [[5,7,0],[0,3,1],[0,5,0]]",
      "output": "false",
      "explanation": "Refer to the diagram above.\nAn X-Matrix should have the green elements (diagonals) be non-zero and the red elements be 0.\nThus, grid is not an X-Matrix."
    }
  ],
  "starterCode": {
    "cpp": "class Solution {\npublic:\n    bool checkXMatrix(vector<vector<int>>& grid) {\n        \n    }\n};",
    "java": "class Solution {\n    public boolean checkXMatrix(int[][] grid) {\n        \n    }\n}",
    "python3": "class Solution:\n    def checkXMatrix(self, grid: list[list[int]]) -> bool:\n        ",
    "python": "class Solution(object):\n    def checkXMatrix(self, grid):\n        \"\"\"\n        :type grid: List[List[int]]\n        :rtype: bool\n        \"\"\"\n        ",
    "javascript": "/**\n * @param {number[][]} grid\n * @return {boolean}\n */\nvar checkXMatrix = function(grid) {\n    \n};",
    "typescript": "function checkXMatrix(grid: number[][]): boolean {\n    \n};",
    "csharp": "public class Solution {\n    public bool CheckXMatrix(int[][] grid) {\n        \n    }\n}",
    "c": "bool checkXMatrix(int** grid, int gridSize, int* gridColSize) {\n    \n}",
    "golang": "func checkXMatrix(grid [][]int) bool {\n    \n}",
    "kotlin": "class Solution {\n    fun checkXMatrix(grid: Array<IntArray>): Boolean {\n        \n    }\n}",
    "swift": "class Solution {\n    func checkXMatrix(_ grid: [[Int]]) -> Bool {\n        \n    }\n}",
    "rust": "impl Solution {\n    pub fn check_x_matrix(grid: Vec<Vec<i32>>) -> bool {\n        \n    }\n}",
    "ruby": "# @param {Integer[][]} grid\n# @return {Boolean}\ndef check_x_matrix(grid)\n    \nend",
    "php": "class Solution {\n\n    /**\n     * @param Integer[][] $grid\n     * @return Boolean\n     */\n    function checkXMatrix($grid) {\n        \n    }\n}",
    "dart": "class Solution {\n  bool checkXMatrix(List<List<int>> grid) {\n    \n  }\n}",
    "scala": "object Solution {\n    def checkXMatrix(grid: Array[Array[Int]]): Boolean = {\n        \n    }\n}",
    "elixir": "defmodule Solution do\n  @spec check_x_matrix(grid :: [[integer]]) :: boolean\n  def check_x_matrix(grid) do\n    \n  end\nend",
    "erlang": "-spec check_x_matrix(Grid :: [[integer()]]) -> boolean().\ncheck_x_matrix(Grid) ->\n  .",
    "racket": "(define/contract (check-x-matrix grid)\n  (-> (listof (listof exact-integer?)) boolean?)\n  )"
  },
  "publicTests": [
    {
      "input": "[[2,0,0,1],[0,3,1,0],[0,5,2,0],[4,0,0,2]]",
      "expectedOutput": "true"
    },
    {
      "input": "[[5,7,0],[0,3,1],[0,5,0]]",
      "expectedOutput": "false"
    }
  ],
  "testCases": [
    {
      "input": "[[2,0,0,1],[0,3,1,0],[0,5,2,0],[4,0,0,2]]",
      "expectedOutput": "true"
    },
    {
      "input": "[[5,7,0],[0,3,1],[0,5,0]]",
      "expectedOutput": "false"
    }
  ],
  "sqlSchema": null,
  "sqlSetup": null,
  "expectedOutput": null,
  "solution": null,
  "hints": [
    "Assuming a 0-indexed matrix, for a given cell on row i and column j, it is in a diagonal if and only if i == j or i == n - 1 - j.",
    "We can then iterate through the elements in the matrix to check if all the elements in the diagonals are non-zero and all other elements are zero."
  ],
  "source": {
    "name": "LeetCode",
    "url": "https://leetcode.com/problems/check-if-matrix-is-x-matrix/",
    "licenseOrPermissionReference": "Authorized collection",
    "collectedAt": "2026-10-19T18:40:14.176Z",
    "sourceUpdatedAt": null
  }
}
