{
  "id": "1584",
  "slug": "min-cost-to-connect-all-points",
  "title": "Min Cost to Connect All Points",
  "category": "dsa",
  "subcategory": "graphs",
  "difficulty": "Medium",
  "tags": [
    "Array",
    "Union-Find",
    "Graph Theory",
    "Minimum Spanning Tree",
    "Prim's Algorithm",
    "Kruskal's Algorithm",
    "Borůvka's Algorithm"
  ],
  "statement": "You are given an array `points` representing integer coordinates of some points on a 2D-plane, where `points[i] = [x_(i), y_(i)]`.\n\nThe cost of connecting two points `[x_(i), y_(i)]` and `[x_(j), y_(j)]` is the **manhattan distance** between them: `|x_(i) - x_(j)| + |y_(i) - y_(j)|`, where `|val|` denotes the absolute value of `val`.\n\nReturn _the minimum cost to make all points connected._ All points are connected if there is **exactly one** simple path between any two points.\n\n**Example 1:**\n\n![](./assets/min-cost-to-connect-all-points-1.png)\n```\nInput: points = [[0,0],[2,2],[3,10],[5,2],[7,0]]\nOutput: 20\nExplanation: \n\nWe can connect the points as shown above to get the minimum cost of 20.\nNotice that there is a unique path between every pair of points.\n```\n\n**Example 2:**\n\n```\nInput: points = [[3,12],[-2,5],[-4,1]]\nOutput: 18\n```\n\n**Constraints:**\n\n*   `1 <= points.length <= 1000`\n*   `-10^(6) <= x_(i), y_(i) <= 10^(6)`\n*   All pairs `(x_(i), y_(i))` are distinct.",
  "constraints": [
    "1 <= points.length <= 1000",
    "-106 <= xi, yi <= 106",
    "All pairs (xi, yi) are distinct."
  ],
  "examples": [
    {
      "input": "points = [[0,0],[2,2],[3,10],[5,2],[7,0]]",
      "output": "20",
      "explanation": "We can connect the points as shown above to get the minimum cost of 20.\nNotice that there is a unique path between every pair of points."
    },
    {
      "input": "points = [[3,12],[-2,5],[-4,1]]",
      "output": "18",
      "explanation": null
    }
  ],
  "starterCode": {
    "cpp": "class Solution {\npublic:\n    int minCostConnectPoints(vector<vector<int>>& points) {\n        \n    }\n};",
    "java": "class Solution {\n    public int minCostConnectPoints(int[][] points) {\n        \n    }\n}",
    "python3": "class Solution:\n    def minCostConnectPoints(self, points: list[list[int]]) -> int:\n        ",
    "python": "class Solution(object):\n    def minCostConnectPoints(self, points):\n        \"\"\"\n        :type points: List[List[int]]\n        :rtype: int\n        \"\"\"\n        ",
    "javascript": "/**\n * @param {number[][]} points\n * @return {number}\n */\nvar minCostConnectPoints = function(points) {\n    \n};",
    "typescript": "function minCostConnectPoints(points: number[][]): number {\n    \n};",
    "csharp": "public class Solution {\n    public int MinCostConnectPoints(int[][] points) {\n        \n    }\n}",
    "c": "int minCostConnectPoints(int** points, int pointsSize, int* pointsColSize) {\n    \n}",
    "golang": "func minCostConnectPoints(points [][]int) int {\n    \n}",
    "kotlin": "class Solution {\n    fun minCostConnectPoints(points: Array<IntArray>): Int {\n        \n    }\n}",
    "swift": "class Solution {\n    func minCostConnectPoints(_ points: [[Int]]) -> Int {\n        \n    }\n}",
    "rust": "impl Solution {\n    pub fn min_cost_connect_points(points: Vec<Vec<i32>>) -> i32 {\n        \n    }\n}",
    "ruby": "# @param {Integer[][]} points\n# @return {Integer}\ndef min_cost_connect_points(points)\n    \nend",
    "php": "class Solution {\n\n    /**\n     * @param Integer[][] $points\n     * @return Integer\n     */\n    function minCostConnectPoints($points) {\n        \n    }\n}",
    "dart": "class Solution {\n  int minCostConnectPoints(List<List<int>> points) {\n    \n  }\n}",
    "scala": "object Solution {\n    def minCostConnectPoints(points: Array[Array[Int]]): Int = {\n        \n    }\n}",
    "elixir": "defmodule Solution do\n  @spec min_cost_connect_points(points :: [[integer]]) :: integer\n  def min_cost_connect_points(points) do\n    \n  end\nend",
    "erlang": "-spec min_cost_connect_points(Points :: [[integer()]]) -> integer().\nmin_cost_connect_points(Points) ->\n  .",
    "racket": "(define/contract (min-cost-connect-points points)\n  (-> (listof (listof exact-integer?)) exact-integer?)\n  )"
  },
  "publicTests": [
    {
      "input": "[[0,0],[2,2],[3,10],[5,2],[7,0]]",
      "expectedOutput": "20"
    },
    {
      "input": "[[3,12],[-2,5],[-4,1]]",
      "expectedOutput": "18"
    }
  ],
  "testCases": [
    {
      "input": "[[0,0],[2,2],[3,10],[5,2],[7,0]]",
      "expectedOutput": "20"
    },
    {
      "input": "[[3,12],[-2,5],[-4,1]]",
      "expectedOutput": "18"
    }
  ],
  "sqlSchema": null,
  "sqlSetup": null,
  "expectedOutput": null,
  "solution": null,
  "hints": [
    "Connect each pair of points with a weighted edge, the weight being the manhattan distance between those points.",
    "The problem is now the cost of minimum spanning tree in graph with above edges."
  ],
  "source": {
    "name": "LeetCode",
    "url": "https://leetcode.com/problems/min-cost-to-connect-all-points/",
    "licenseOrPermissionReference": "Authorized collection",
    "collectedAt": "2026-10-19T18:40:23.178Z",
    "sourceUpdatedAt": null
  }
}
