{
  "id": "743",
  "slug": "network-delay-time",
  "title": "Network Delay Time",
  "category": "dsa",
  "subcategory": "graphs",
  "difficulty": "Medium",
  "tags": [
    "Depth-First Search",
    "Breadth-First Search",
    "Graph Theory",
    "Heap (Priority Queue)",
    "Shortest Path",
    "Dijkstra's Algorithm"
  ],
  "statement": "You are given a network of `n` nodes, labeled from `1` to `n`. You are also given `times`, a list of travel times as directed edges `times[i] = (u_(i), v_(i), w_(i))`, where `u_(i)` is the source node, `v_(i)` is the target node, and `w_(i)` is the time it takes for a signal to travel from source to target.\n\nWe will send a signal from a given node `k`. Return _the **minimum** time it takes for all the_ `n` _nodes to receive the signal_. If it is impossible for all the `n` nodes to receive the signal, return `-1`.\n\n**Example 1:**\n\n![](./assets/network-delay-time-1.png)\n```\nInput: times = [[2,1,1],[2,3,1],[3,4,1]], n = 4, k = 2\nOutput: 2\n```\n\n**Example 2:**\n\n```\nInput: times = [[1,2,1]], n = 2, k = 1\nOutput: 1\n```\n\n**Example 3:**\n\n```\nInput: times = [[1,2,1]], n = 2, k = 2\nOutput: -1\n```\n\n**Constraints:**\n\n*   `1 <= k <= n <= 100`\n*   `1 <= times.length <= 6000`\n*   `times[i].length == 3`\n*   `1 <= u_(i), v_(i) <= n`\n*   `u_(i) != v_(i)`\n*   `0 <= w_(i) <= 100`\n*   All the pairs `(u_(i), v_(i))` are **unique**. (i.e., no multiple edges.)",
  "constraints": [
    "1 <= k <= n <= 100",
    "1 <= times.length <= 6000",
    "times[i].length == 3",
    "1 <= ui, vi <= n",
    "ui != vi",
    "0 <= wi <= 100",
    "All the pairs (ui, vi) are unique. (i.e., no multiple edges.)"
  ],
  "examples": [
    {
      "input": "times = [[2,1,1],[2,3,1],[3,4,1]], n = 4, k = 2",
      "output": "2",
      "explanation": null
    },
    {
      "input": "times = [[1,2,1]], n = 2, k = 1",
      "output": "1",
      "explanation": null
    },
    {
      "input": "times = [[1,2,1]], n = 2, k = 2",
      "output": "-1",
      "explanation": null
    }
  ],
  "starterCode": {
    "cpp": "class Solution {\npublic:\n    int networkDelayTime(vector<vector<int>>& times, int n, int k) {\n        \n    }\n};",
    "java": "class Solution {\n    public int networkDelayTime(int[][] times, int n, int k) {\n        \n    }\n}",
    "python3": "class Solution:\n    def networkDelayTime(self, times: list[list[int]], n: int, k: int) -> int:\n        ",
    "python": "class Solution(object):\n    def networkDelayTime(self, times, n, k):\n        \"\"\"\n        :type times: List[List[int]]\n        :type n: int\n        :type k: int\n        :rtype: int\n        \"\"\"\n        ",
    "javascript": "/**\n * @param {number[][]} times\n * @param {number} n\n * @param {number} k\n * @return {number}\n */\nvar networkDelayTime = function(times, n, k) {\n    \n};",
    "typescript": "function networkDelayTime(times: number[][], n: number, k: number): number {\n\n};",
    "csharp": "public class Solution {\n    public int NetworkDelayTime(int[][] times, int n, int k) {\n        \n    }\n}",
    "c": "int networkDelayTime(int** times, int timesSize, int* timesColSize, int n, int k){\n\n}",
    "golang": "func networkDelayTime(times [][]int, n int, k int) int {\n    \n}",
    "kotlin": "class Solution {\n    fun networkDelayTime(times: Array<IntArray>, n: Int, k: Int): Int {\n        \n    }\n}",
    "swift": "class Solution {\n    func networkDelayTime(_ times: [[Int]], _ n: Int, _ k: Int) -> Int {\n        \n    }\n}",
    "rust": "impl Solution {\n    pub fn network_delay_time(times: Vec<Vec<i32>>, n: i32, k: i32) -> i32 {\n        \n    }\n}",
    "ruby": "# @param {Integer[][]} times\n# @param {Integer} n\n# @param {Integer} k\n# @return {Integer}\ndef network_delay_time(times, n, k)\n    \nend",
    "php": "class Solution {\n\n    /**\n     * @param Integer[][] $times\n     * @param Integer $n\n     * @param Integer $k\n     * @return Integer\n     */\n    function networkDelayTime($times, $n, $k) {\n        \n    }\n}",
    "dart": "class Solution {\n  int networkDelayTime(List<List<int>> times, int n, int k) {\n\n  }\n}",
    "scala": "object Solution {\n    def networkDelayTime(times: Array[Array[Int]], n: Int, k: Int): Int = {\n        \n    }\n}",
    "elixir": "defmodule Solution do\n  @spec network_delay_time(times :: [[integer]], n :: integer, k :: integer) :: integer\n  def network_delay_time(times, n, k) do\n\n  end\nend",
    "erlang": "-spec network_delay_time(Times :: [[integer()]], N :: integer(), K :: integer()) -> integer().\nnetwork_delay_time(Times, N, K) ->\n  .",
    "racket": "(define/contract (network-delay-time times n k)\n  (-> (listof (listof exact-integer?)) exact-integer? exact-integer? exact-integer?)\n\n  )"
  },
  "publicTests": [
    {
      "input": "[[2,1,1],[2,3,1],[3,4,1]]\n4\n2",
      "expectedOutput": "2"
    },
    {
      "input": "[[1,2,1]]\n2\n1",
      "expectedOutput": "1"
    },
    {
      "input": "[[1,2,1]]\n2\n2",
      "expectedOutput": "-1"
    }
  ],
  "testCases": [
    {
      "input": "[[2,1,1],[2,3,1],[3,4,1]]\n4\n2",
      "expectedOutput": "2"
    },
    {
      "input": "[[1,2,1]]\n2\n1",
      "expectedOutput": "1"
    },
    {
      "input": "[[1,2,1]]\n2\n2",
      "expectedOutput": "-1"
    },
    {
      "input": "[[2,1,1],[2,3,1],[3,4,1]]\n5\n2",
      "expectedOutput": "-1"
    },
    {
      "input": "[[2,1,1],[2,3,1],[3,4,1]]\n6\n2",
      "expectedOutput": "-1"
    },
    {
      "input": "[[2,1,1],[2,3,1],[3,4,1]]\n7\n2",
      "expectedOutput": "-1"
    },
    {
      "input": "[[2,1,1],[2,3,1],[3,4,1]]\n8\n2",
      "expectedOutput": "-1"
    },
    {
      "input": "[[2,1,1],[2,3,1],[3,4,1]]\n9\n2",
      "expectedOutput": "-1"
    },
    {
      "input": "[[2,1,1],[2,3,1],[3,4,1]]\n4\n0",
      "expectedOutput": "-1"
    },
    {
      "input": "[[2,1,1],[2,3,1],[3,4,1]]\n4\n1",
      "expectedOutput": "-1"
    },
    {
      "input": "[[2,1,1],[2,3,1],[3,4,1]]\n4\n3",
      "expectedOutput": "-1"
    },
    {
      "input": "[[2,1,1],[2,3,1],[3,4,1]]\n4\n4",
      "expectedOutput": "-1"
    },
    {
      "input": "[[2,1,1],[2,3,1],[3,4,1]]\n4\n-1",
      "expectedOutput": "-1"
    },
    {
      "input": "[[2,1,1],[2,3,1],[3,4,1]]\n4\n-2",
      "expectedOutput": "2"
    },
    {
      "input": "[[1,2,1]]\n3\n1",
      "expectedOutput": "-1"
    },
    {
      "input": "[[1,2,1]]\n4\n1",
      "expectedOutput": "-1"
    },
    {
      "input": "[[1,2,1]]\n5\n1",
      "expectedOutput": "-1"
    },
    {
      "input": "[[1,2,1]]\n6\n1",
      "expectedOutput": "-1"
    },
    {
      "input": "[[1,2,1]]\n7\n1",
      "expectedOutput": "-1"
    },
    {
      "input": "[[1,2,1]]\n2\n0",
      "expectedOutput": "-1"
    }
  ],
  "sqlSchema": null,
  "sqlSetup": null,
  "expectedOutput": null,
  "solution": null,
  "hints": [
    "We visit each node at some time, and if that time is better than the fastest time we've reached this node, we travel along outgoing edges in sorted order.  Alternatively, we could use Dijkstra's algorithm."
  ],
  "source": {
    "name": "LeetCode",
    "url": "https://leetcode.com/problems/network-delay-time/",
    "licenseOrPermissionReference": "Authorized collection",
    "collectedAt": "2026-10-19T18:40:25.616Z",
    "sourceUpdatedAt": null
  }
}
