{
  "id": "3978",
  "slug": "unique-middle-element",
  "title": "Unique Middle Element",
  "category": "dsa",
  "subcategory": "mathematics",
  "difficulty": "Easy",
  "tags": [
    "Array",
    "Counting"
  ],
  "statement": "You are given an integer array `nums` of odd length `n`.\n\nReturn `true` if the middle element of `nums` appears **exactly** once in the array. Otherwise return `false`.\n\n**Example 1:**\n\n**Input:** nums = \\[1,2,3\\]\n\n**Output:** true\n\n**Explanation:**\n\nThe middle element of `nums` is 2, which appears exactly once.\n\nThus, the answer is `true`.\n\n**Example 2:**\n\n**Input:** nums = \\[1,2,2\\]\n\n**Output:** false\n\n**Explanation:**\n\nThe middle element of `nums` is 2, which appears twice.\n\nThus, the answer is `false`.\n\n**Constraints:**\n\n*   `1 <= n == nums.length <= 100`\n*   `n` is odd.\n*   `1 <= nums[i] <= 100`",
  "constraints": [
    "1 <= n == nums.length <= 100",
    "n is odd.",
    "1 <= nums[i] <= 100"
  ],
  "examples": [
    {
      "input": "nums = [1,2,3]",
      "output": "true",
      "explanation": null
    },
    {
      "input": "nums = [1,2,2]",
      "output": "false",
      "explanation": null
    }
  ],
  "starterCode": {
    "cpp": "class Solution {\npublic:\n    bool isMiddleElementUnique(vector<int>& nums) {\n        \n    }\n};",
    "java": "class Solution {\n    public boolean isMiddleElementUnique(int[] nums) {\n        \n    }\n}",
    "python3": "class Solution:\n    def isMiddleElementUnique(self, nums: list[int]) -> bool:\n        ",
    "python": "class Solution(object):\n    def isMiddleElementUnique(self, nums):\n        \"\"\"\n        :type nums: List[int]\n        :rtype: bool\n        \"\"\"\n        ",
    "javascript": "/**\n * @param {number[]} nums\n * @return {boolean}\n */\nvar isMiddleElementUnique = function(nums) {\n    \n};",
    "typescript": "function isMiddleElementUnique(nums: number[]): boolean {\n    \n};",
    "csharp": "public class Solution {\n    public bool IsMiddleElementUnique(int[] nums) {\n        \n    }\n}",
    "c": "bool isMiddleElementUnique(int* nums, int numsSize) {\n    \n}",
    "golang": "func isMiddleElementUnique(nums []int) bool {\n    \n}",
    "kotlin": "class Solution {\n    fun isMiddleElementUnique(nums: IntArray): Boolean {\n        \n    }\n}",
    "swift": "class Solution {\n    func isMiddleElementUnique(_ nums: [Int]) -> Bool {\n        \n    }\n}",
    "rust": "impl Solution {\n    pub fn is_middle_element_unique(nums: Vec<i32>) -> bool {\n        \n    }\n}",
    "ruby": "# @param {Integer[]} nums\n# @return {Boolean}\ndef is_middle_element_unique(nums)\n    \nend",
    "php": "class Solution {\n\n    /**\n     * @param Integer[] $nums\n     * @return Boolean\n     */\n    function isMiddleElementUnique($nums) {\n        \n    }\n}",
    "dart": "class Solution {\n  bool isMiddleElementUnique(List<int> nums) {\n    \n  }\n}",
    "scala": "object Solution {\n    def isMiddleElementUnique(nums: Array[Int]): Boolean = {\n        \n    }\n}",
    "elixir": "defmodule Solution do\n  @spec is_middle_element_unique(nums :: [integer]) :: boolean\n  def is_middle_element_unique(nums) do\n    \n  end\nend",
    "erlang": "-spec is_middle_element_unique(Nums :: [integer()]) -> boolean().\nis_middle_element_unique(Nums) ->\n  .",
    "racket": "(define/contract (is-middle-element-unique nums)\n  (-> (listof exact-integer?) boolean?)\n  )"
  },
  "publicTests": [
    {
      "input": "[1,2,3]",
      "expectedOutput": "true"
    },
    {
      "input": "[1,2,2]",
      "expectedOutput": "false"
    }
  ],
  "testCases": [
    {
      "input": "[1,2,3]",
      "expectedOutput": "true"
    },
    {
      "input": "[1,2,2]",
      "expectedOutput": "false"
    },
    {
      "input": "[1]",
      "expectedOutput": "true"
    },
    {
      "input": "[2,3]",
      "expectedOutput": "true"
    },
    {
      "input": "[1,3]",
      "expectedOutput": "true"
    },
    {
      "input": "[1,2]",
      "expectedOutput": "true"
    },
    {
      "input": "[3,2,1]",
      "expectedOutput": "true"
    },
    {
      "input": "[1,1,1]",
      "expectedOutput": "false"
    },
    {
      "input": "[1,2,3,1,2,3]",
      "expectedOutput": "false"
    },
    {
      "input": "[2,4,6]",
      "expectedOutput": "true"
    },
    {
      "input": "[2,3,4]",
      "expectedOutput": "true"
    },
    {
      "input": "[0,1,2]",
      "expectedOutput": "true"
    },
    {
      "input": "[-1,-2,-3]",
      "expectedOutput": "true"
    },
    {
      "input": "[0,0,0]",
      "expectedOutput": "false"
    },
    {
      "input": "[0]",
      "expectedOutput": "true"
    },
    {
      "input": "[-1]",
      "expectedOutput": "true"
    },
    {
      "input": "[0,0]",
      "expectedOutput": "false"
    },
    {
      "input": "[2,1]",
      "expectedOutput": "true"
    },
    {
      "input": "[1,1]",
      "expectedOutput": "false"
    },
    {
      "input": "[-1,1]",
      "expectedOutput": "true"
    }
  ],
  "sqlSchema": null,
  "sqlSetup": null,
  "expectedOutput": null,
  "solution": null,
  "hints": [
    "The middle index is <code>nums.length / 2</code>.",
    "Count how many times <code>nums[nums.length / 2]</code> appears in <code>nums</code>."
  ],
  "source": {
    "name": "LeetCode",
    "url": "https://leetcode.com/problems/unique-middle-element/",
    "licenseOrPermissionReference": "Authorized collection",
    "collectedAt": "2026-10-19T18:40:31.393Z",
    "sourceUpdatedAt": null
  }
}
