{
  "id": "134",
  "slug": "gas-station",
  "title": "Gas Station",
  "category": "dsa",
  "subcategory": "greedy",
  "difficulty": "Medium",
  "tags": [
    "Array",
    "Greedy"
  ],
  "statement": "There are `n` gas stations along a circular route, where the amount of gas at the `i^(th)` station is `gas[i]`.\n\nYou have a car with an unlimited gas tank and it costs `cost[i]` of gas to travel from the `i^(th)` station to its next `(i + 1)^(th)` station. You begin the journey with an empty tank at one of the gas stations.\n\nGiven two integer arrays `gas` and `cost`, return _the starting gas station's index if you can travel around the circuit once in the clockwise direction, otherwise return_ `-1`. If there exists a solution, it is **guaranteed** to be **unique**.\n\n**Example 1:**\n\n```\nInput: gas = [1,2,3,4,5], cost = [3,4,5,1,2]\nOutput: 3\nExplanation:\nStart at station 3 (index 3) and fill up with 4 unit of gas. Your tank = 0 + 4 = 4\nTravel to station 4. Your tank = 4 - 1 + 5 = 8\nTravel to station 0. Your tank = 8 - 2 + 1 = 7\nTravel to station 1. Your tank = 7 - 3 + 2 = 6\nTravel to station 2. Your tank = 6 - 4 + 3 = 5\nTravel to station 3. The cost is 5. Your gas is just enough to travel back to station 3.\nTherefore, return 3 as the starting index.\n```\n\n**Example 2:**\n\n```\nInput: gas = [2,3,4], cost = [3,4,3]\nOutput: -1\nExplanation:\nYou can't start at station 0 or 1, as there is not enough gas to travel to the next station.\nLet's start at station 2 and fill up with 4 unit of gas. Your tank = 0 + 4 = 4\nTravel to station 0. Your tank = 4 - 3 + 2 = 3\nTravel to station 1. Your tank = 3 - 3 + 3 = 3\nYou cannot travel back to station 2, as it requires 4 unit of gas but you only have 3.\nTherefore, you can't travel around the circuit once no matter where you start.\n```\n\n**Constraints:**\n\n*   `n == gas.length == cost.length`\n*   `1 <= n <= 10^(5)`\n*   `0 <= gas[i], cost[i] <= 10^(4)`\n*   The input is generated such that the answer is unique.",
  "constraints": [
    "n == gas.length == cost.length",
    "1 <= n <= 105",
    "0 <= gas[i], cost[i] <= 104",
    "The input is generated such that the answer is unique."
  ],
  "examples": [
    {
      "input": "gas = [1,2,3,4,5], cost = [3,4,5,1,2]",
      "output": "3",
      "explanation": "Start at station 3 (index 3) and fill up with 4 unit of gas. Your tank = 0 + 4 = 4\nTravel to station 4. Your tank = 4 - 1 + 5 = 8\nTravel to station 0. Your tank = 8 - 2 + 1 = 7\nTravel to station 1. Your tank = 7 - 3 + 2 = 6\nTravel to station 2. Your tank = 6 - 4 + 3 = 5\nTravel to station 3. The cost is 5. Your gas is just enough to travel back to station 3.\nTherefore, return 3 as the starting index."
    },
    {
      "input": "gas = [2,3,4], cost = [3,4,3]",
      "output": "-1",
      "explanation": "You can't start at station 0 or 1, as there is not enough gas to travel to the next station.\nLet's start at station 2 and fill up with 4 unit of gas. Your tank = 0 + 4 = 4\nTravel to station 0. Your tank = 4 - 3 + 2 = 3\nTravel to station 1. Your tank = 3 - 3 + 3 = 3\nYou cannot travel back to station 2, as it requires 4 unit of gas but you only have 3.\nTherefore, you can't travel around the circuit once no matter where you start."
    }
  ],
  "starterCode": {
    "cpp": "class Solution {\npublic:\n    int canCompleteCircuit(vector<int>& gas, vector<int>& cost) {\n        \n    }\n};",
    "java": "class Solution {\n    public int canCompleteCircuit(int[] gas, int[] cost) {\n        \n    }\n}",
    "python3": "class Solution:\n    def canCompleteCircuit(self, gas: list[int], cost: list[int]) -> int:\n        ",
    "python": "class Solution(object):\n    def canCompleteCircuit(self, gas, cost):\n        \"\"\"\n        :type gas: List[int]\n        :type cost: List[int]\n        :rtype: int\n        \"\"\"\n        ",
    "javascript": "/**\n * @param {number[]} gas\n * @param {number[]} cost\n * @return {number}\n */\nvar canCompleteCircuit = function(gas, cost) {\n    \n};",
    "typescript": "function canCompleteCircuit(gas: number[], cost: number[]): number {\n    \n};",
    "csharp": "public class Solution {\n    public int CanCompleteCircuit(int[] gas, int[] cost) {\n        \n    }\n}",
    "c": "int canCompleteCircuit(int* gas, int gasSize, int* cost, int costSize) {\n    \n}",
    "golang": "func canCompleteCircuit(gas []int, cost []int) int {\n    \n}",
    "kotlin": "class Solution {\n    fun canCompleteCircuit(gas: IntArray, cost: IntArray): Int {\n        \n    }\n}",
    "swift": "class Solution {\n    func canCompleteCircuit(_ gas: [Int], _ cost: [Int]) -> Int {\n        \n    }\n}",
    "rust": "impl Solution {\n    pub fn can_complete_circuit(gas: Vec<i32>, cost: Vec<i32>) -> i32 {\n        \n    }\n}",
    "ruby": "# @param {Integer[]} gas\n# @param {Integer[]} cost\n# @return {Integer}\ndef can_complete_circuit(gas, cost)\n    \nend",
    "php": "class Solution {\n\n    /**\n     * @param Integer[] $gas\n     * @param Integer[] $cost\n     * @return Integer\n     */\n    function canCompleteCircuit($gas, $cost) {\n        \n    }\n}",
    "dart": "class Solution {\n  int canCompleteCircuit(List<int> gas, List<int> cost) {\n    \n  }\n}",
    "scala": "object Solution {\n    def canCompleteCircuit(gas: Array[Int], cost: Array[Int]): Int = {\n        \n    }\n}",
    "elixir": "defmodule Solution do\n  @spec can_complete_circuit(gas :: [integer], cost :: [integer]) :: integer\n  def can_complete_circuit(gas, cost) do\n    \n  end\nend",
    "erlang": "-spec can_complete_circuit(Gas :: [integer()], Cost :: [integer()]) -> integer().\ncan_complete_circuit(Gas, Cost) ->\n  .",
    "racket": "(define/contract (can-complete-circuit gas cost)\n  (-> (listof exact-integer?) (listof exact-integer?) exact-integer?)\n  )"
  },
  "publicTests": [
    {
      "input": "[1,2,3,4,5]\n[3,4,5,1,2]",
      "expectedOutput": "3"
    },
    {
      "input": "[2,3,4]\n[3,4,3]",
      "expectedOutput": "-1"
    }
  ],
  "testCases": [
    {
      "input": "[1,2,3,4,5]\n[3,4,5,1,2]",
      "expectedOutput": "3"
    },
    {
      "input": "[2,3,4]\n[3,4,3]",
      "expectedOutput": "-1"
    },
    {
      "input": "[1,2]\n[3,4,5,1,2]",
      "expectedOutput": "-1"
    },
    {
      "input": "[3,4,5]\n[3,4,5,1,2]",
      "expectedOutput": "2"
    },
    {
      "input": "[1]\n[3,4,5,1,2]",
      "expectedOutput": "-1"
    },
    {
      "input": "[1,5]\n[3,4,5,1,2]",
      "expectedOutput": "-1"
    },
    {
      "input": "[5,4,3,2,1]\n[3,4,5,1,2]",
      "expectedOutput": "3"
    },
    {
      "input": "[1,1,1,1,1]\n[3,4,5,1,2]",
      "expectedOutput": "-1"
    },
    {
      "input": "[2,4,6,8,10]\n[3,4,5,1,2]",
      "expectedOutput": "4"
    },
    {
      "input": "[2,3,4,5,6]\n[3,4,5,1,2]",
      "expectedOutput": "4"
    },
    {
      "input": "[0,1,2,3,4]\n[3,4,5,1,2]",
      "expectedOutput": "-1"
    },
    {
      "input": "[-1,-2,-3,-4,-5]\n[3,4,5,1,2]",
      "expectedOutput": "-1"
    },
    {
      "input": "[0,0,0,0]\n[3,4,5,1,2]",
      "expectedOutput": "-1"
    },
    {
      "input": "[1,1,1,1]\n[3,4,5,1,2]",
      "expectedOutput": "-1"
    },
    {
      "input": "[0]\n[3,4,5,1,2]",
      "expectedOutput": "-1"
    },
    {
      "input": "[-1]\n[3,4,5,1,2]",
      "expectedOutput": "-1"
    },
    {
      "input": "[0,0]\n[3,4,5,1,2]",
      "expectedOutput": "-1"
    },
    {
      "input": "[2,1]\n[3,4,5,1,2]",
      "expectedOutput": "-1"
    },
    {
      "input": "[1,1]\n[3,4,5,1,2]",
      "expectedOutput": "-1"
    },
    {
      "input": "[-1,1]\n[3,4,5,1,2]",
      "expectedOutput": "-1"
    }
  ],
  "sqlSchema": null,
  "sqlSetup": null,
  "expectedOutput": null,
  "solution": null,
  "hints": [],
  "source": {
    "name": "LeetCode",
    "url": "https://leetcode.com/problems/gas-station/",
    "licenseOrPermissionReference": "Authorized collection",
    "collectedAt": "2026-10-19T18:40:19.125Z",
    "sourceUpdatedAt": null
  }
}
